identifiant,week_day,date,time,type_event,phase,location,country,total_occupants,total_fatalities,aircraft_damage,aircraft_fate,type_aircraft,number_engines,type_engines,first_flight,cycles,total_airframe_hours,registration,c_n_msn,operator,nature,flight_number,departure_airport_name,departure_airport_IATA,departure_airport_ICAO,departure_airport_country,destination_airport_name,destination_airport_IATA,destination_airport_ICAO,destination_airport_country,crew_number,passengers_number,crew_fatalities,passengers_fatalities,collision_casualties,ground_casualties,status
20120109-0,Monday,09-JAN-2012,07:20,A2, Landing (LDG),Guayaramerin Airport (GYA),Bolivia,21,0, Substantial,-,Xian MA60,-,-,2007,-,-, FAB-96, 0503,TAM,Military,-,Riberalta-Gen Buech Airport,RIB,SLRI,Bolivia,Guayaramerín Airport,GYA,SLGY,Bolivia,5,16,0,0,-,-,Preliminary
20120112-0,Thursday,12-JAN-2012,19:55,A1, Takeoff (TOF),Kichwa Tembo Airstrip,Kenya,6,0, Substantial,-,Let L-410UVP-E9,2,Walter M-601E,1989,-,-, 5Y-BSA, 892323,Blue Sky Aviation,Domestic Scheduled Passenger,-,-,-,-,-,-,-,-,-,2,4,0,0,-,-,Preliminary - official
20120118-0,Wednesday,18-JAN-2012,17:11,A2, En route (ENR),near Kitakojima Island,Japan,9,0, Substantial, Repaired,de Havilland Canada DHC-8-315Q MPA,-,-,2007,-,2858.0, JA720A, 651,Japan Coast Guard,Survey/research,-,Okinawa-Naha Airport,OKA,ROAH,Japan,Ishigaki Airport,ISG,ROIG,Japan,9,0,0,0,-,-,Final
20120124-0,Tuesday,24-JAN-2012,08:28,A1, Landing (LDG),Kandahar Airport (KDH),Afghanistan,91,0, Substantial, Written off (damaged beyond repair),McDonnell Douglas DC-9-83 (MD-83),2,Pratt & Whitney JT8D-219,1989,-,-, EC-JJS, 49793/1656,Swiftair,International Scheduled Passenger, 094,Dubai Airport,DXB,OMDB,United Arab Emirates,Kandahar Airport,KDH,OAKN,Afghanistan,5,86,0,0,-,-,Final
20120124-1,Tuesday,24-JAN-2012,-,O1, Standing (STD),"Providence-Theodore Francis Greene State Airport, RI (PVD)",United States of America,-,0, Substantial, Written off (damaged beyond repair),Canadair CL-600-2B19 Regional Jet CRJ-200ER,2,General Electric CF34-3B1,2001,-,-, N8524A, 7524,Pinnacle Airlines,-,-,-,-,-,-,-,-,-,-,-,-,0,0,-,-,Preliminary
20120130-0,Monday,30-JAN-2012,08:45,A1, Approach (APR),10 km (6.3 mls) from  Namoya,Democratic Republic of the Congo,5,3, Damaged beyond repair,-,Antonov An-28,-,-,1989,-,-, 9Q-CUN, 1AJ006-11,TRACEP-Congo Aviation,Cargo,-,Bukavu-Kamenbe Airport,BKY,FZMA,Democratic Republic of the Congo,-,-,-,-,2,3,2,1,-,-,Preliminary
20120205-0,Sunday,05-FEB-2012,09:03,A1, Landing (LDG),Sendai Airport (SDJ),Japan,166,0, Substantial,-,Airbus A320-211,2,CFMI CFM56-5A1,1990,-,43423.0, JA8384, 151,All Nippon,Domestic Scheduled Passenger, 731,Osaka-Itami Airport,ITM,RJOO,Japan,Sendai Airport,SDJ,RJSS,Japan,6,160,0,0,-,-,Final
20120209-0,Thursday,09-FEB-2012,12:08,A2, Landing (LDG),Male International Airport (MLE),Maldives,12,0, Substantial, Repaired,de Havilland Canada DHC-6 Twin Otter 200,2,Pratt & Whitney Canada PT6A-20,1968,-,-, 8Q-MAT, 146,Maldivian Air Taxi,Domestic Scheduled Passenger,-,-,-,-,-,Malé International Airport,MLE,VRMM,Maldives,3,9,0,0,-,-,Preliminary - official
20120212-0,Sunday,12-FEB-2012,13:00,A1, Landing (LDG),Bukavu-Kavumu Airport (BKY),Democratic Republic of the Congo,12,4, Damaged beyond repair,-,Gulfstream G-IV,2,Rolls-Royce Tay 610-8,1989,-,-, N2SA, 1104,Trident Aviation Services,Executive,-,Goma Airport,GOM,FZNA,Democratic Republic of the Congo,Bukavu-Kavumu Airport,BKY,FZMA,Democratic Republic of the Congo,2,10,2,2,-,2,Preliminary
20120212-1,Sunday,12-FEB-2012,14:30,H2, En route (ENR),"Porto Alegre-Salgado Filho International Airport, RS (POA/SBPA)",Brazil,-,0, None, -,Airbus A320-232,2,IAE V2527-A5,2002,-,-, PR-MAR, 1888,TAM Brasil,International Scheduled Passenger,JJ8047,Montevideo-Carrasco Airport,MVD,SUMU,Uruguay,São Paulo-Guarulhos International Airport,GRU,SBGR,Brazil,-,-,0,0,-,-,Preliminary
20120213-0,Monday,13-FEB-2012,22:00,A1, Takeoff (TOF),"Brooksville-Hernando County Airport, FL",United States of America,3,0, Substantial, Written off (damaged beyond repair),Learjet 55,-,-,1982,-,-, N75LJ, 55-065,Jet ICU Air Ambulance Service,Ferry/positioning,-,-,-,-,-,Houston-William P. Hobby Airport,HOU,KHOU,United States of America,3,0,0,0,-,-,- (No safety board investigation)
20120213-1,Monday,13-FEB-2012,10:40,A2, Landing (LDG),Kalibo Airport (KLO),Philippines,142,0, Minor, Repaired,Airbus A320-214,2,CFMI CFM56-5B4/P,2004,-,-, RP-C3227, 2183,Airphil Express,Domestic Scheduled Passenger,969,Manila-Ninoy Aquino International Airport,MNL,RPLL,Philippines,Kalibo Airport,KLO,RPVK,Philippines,7,135,0,0,-,-,Final
20120213-2,Monday,13-FEB-2012,11:08,A1, Takeoff (TOF),Craiova Airport (CRA),Romania,55,0, Substantial, Written off (damaged beyond repair),Saab 2000,2,Allison AE2100A,1996,-,-, YR-SBK, 033,Carpatair,Domestic Scheduled Passenger,V32385,Craiova Airport,CRA,LRCV,Romania,Timisoara Airport,TSR,LRTR,Romania,4,51,0,0,-,-,Final
20120214-0,Tuesday,14-FEB-2012,13:59,A2, Landing (LDG),London-Luton Airport (LTN),United Kingdom,148,0, Minor, Repaired,Airbus A319-111,2,CFMI CFM56-5B5/3,2010,-,-, G-EZFV, 4327,easyJet,International Scheduled Passenger,-,Faro Airport,FAO,LPFR,Portugal,London-Luton Airport,LTN,EGGW,United Kingdom,6,142,0,0,-,-,Final
20120217-0,Friday,17-FEB-2012,-,A1, Landing (LDG),"Tanay Airfield, Kemerovo Oblast",Russia,-,0, Substantial, Written off (damaged beyond repair),Let L-410UVP,-,-,1984,-,-, RF-01152, 841213,DOSAAF,Training,-,-,-,-,-,-,-,-,-,-,-,0,0,-,-,Preliminary
20120217-1,Friday,17-FEB-2012,10:53,A1, Landing (LDG),Thandwe Airport (SNW),Myanmar,54,0, Substantial, Written off (damaged beyond repair),ATR 72-212A (ATR-72-500),2,Pratt & Whitney Canada PW127F,1998,-,-, XY-AIT, 543,Air KBZ,Domestic Scheduled Passenger, 243,Heho Airport,HEH,VYHH,Myanmar,Thandwe Airport,SNW,VYTD,Myanmar,4,50,0,0,-,-,Preliminary
20120221-0,Tuesday,21-FEB-2012,08:58,A1, Takeoff (TOF),"Key West NAS, FL (NQX)",United States of America,9,0, Substantial, Written off (damaged beyond repair),Lockheed CC-130H(T) Hercules,-,-,1991,-,12839.0, 130342, 5207,RCAF,Military,-,Key West NAS,NQX,KNQX,United States of America,Key West NAS,NQX,KNQX,United States of America,7,2,0,0,-,-,Final
20120228-0,Tuesday,28-FEB-2012,07:15,A1, Initial climb (ICL),"ca 0,2 km W of Manaus-Aeroclube de Flores Airport, AM",Brazil,1,1, Destroyed, Written off (damaged beyond repair),Cessna 208B Grand Caravan,1,Pratt & Whitney Canada PT6A-114A,1999,-,-, PT-PTB, 208B0766,CTA - Cleiton Taxi Aéreo,Ferry/positioning,-,-,-,-,-,Manaus-Eduardo Gomes International Airport,MAO,SBEG,Brazil,1,0,1,0,-,-,Final
20120301-0,Thursday,01-MAR-2012,18:58,A1, Approach (APR),ca 4 km E of Egelsbach Airport,Germany,5,5, Destroyed, Written off (damaged beyond repair),Cessna 750 Citation X,2,Rolls-Royce AE3007C1,2003,-,-, N288CX, 750-0219,Asia Today,Executive,-,Linz-Blue Danube Airport,LNZ,LOWL,Austria,-,-,-,-,2,3,2,3,-,-,Preliminary - official
20120302-0,Friday,02-MAR-2012,-,O1, Standing (STD),"Paulding Northwest Atlanta Airport, GA",United States of America,0,0, Damaged beyond repair,-,Cessna 650 Citation III,-,-,1984,-,-, N72EP, 650-0058,Jeffy Jet,-,-,-,-,-,-,-,-,-,-,0,0,0,0,-,-,-
20120304-0,Sunday,04-MAR-2012,-,O1, Standing (STD),Sana'a-Al Dalaimi Air Base (SAH),Yemen,0,0, Damaged beyond repair,-,Antonov An-26,-,-,-,-,-, 617, 12302,Yemen AF,Military,-,-,-,-,-,-,-,-,-,0,0,0,0,-,-,-
20120307-0,Wednesday,07-MAR-2012,-,H2, En route (ENR),El Obeid Airport (EBD),Sudan,-,0, None,-,Boeing 737-500 ?,-,-,-,-,-, registration unknown,-, Sudan Airways,Domestic Scheduled Passenger,-,Geneina Airport,EGN,HSCN,Sudan,Khartoum-Civil Airport,KRT,HSSS,Sudan,-,-,0,0,-,-,Preliminary
20120308-0,Thursday,08-MAR-2012,17:57,A2, Landing (LDG),Isle Of Man-Ronaldsway Airport (IOM),United Kingdom,14,0, Substantial, Repaired,British Aerospace 3102 Jetstream 31,2,Garrett TPE331-10UGR-516H,1987,-,-, G-CCPW, 785,Links Air,Domestic Scheduled Passenger, 309,Leeds/Bradford Airport,LBA,EGNM,United Kingdom,Isle Of Man-Ronaldsway Airport,IOM,EGNS,United Kingdom,2,12,0,0,-,-,Final
20120309-0,Friday,09-MAR-2012,11:30,A1, Landing (LDG),"Laguna Caballococha, Ramón Castilla, Loreto",Peru,11,0, Substantial, Written off (damaged beyond repair),de Havilland Canada DHC-6 Twin Otter 300,2,Pratt & Whitney Canada PT6A-27,1971,-,-, FAP-317, 324,Peruvian AF,Domestic Non Scheduled Passenger,-,Iquitos Airport,IQT,SPQT,Peru,-,-,-,-,3,8,0,0,-,-,Preliminary
20120309-1,Friday,09-MAR-2012,14:10,A1, Landing (LDG),Deadman's Cay Airport (LGI),Bahamas,-,0, Damaged beyond repair,-,Beechcraft 100 King Air,2,Pratt & Whitney Canada PT6A-28,1971,-,-, N70JL, B-87,Southern Air Charter,Passenger,-,Nassau-Lynden Pindling International Airport,NAS,MYNN,Bahamas,Deadman's Cay Airport,LGI,MYLD,Bahamas,-,-,0,0,-,-,Preliminary
20120313-0,Tuesday,13-MAR-2012,05:00,O2, Standing (STD),"Atlanta Hartsfield-Jackson International Airport, GA (ATL)",United States of America,2,0, Substantial, Repaired,Boeing 737-732 (WL),2,CFMI CFM56-7B24,2009,-,-, N309DE, 29634/3031,Delta Air Lines,-,-,-,-,-,-,-,-,-,-,2,0,0,0,-,-,- (No safety board investigation)
20120315-0,Thursday,15-MAR-2012,07:38,A1, Initial climb (ICL),"1,5 km (0.9 mls) E of San Juan-Luis Muñoz Marín International Airport (SJU)",Puerto Rico,2,2, Destroyed, Written off (damaged beyond repair),Convair CV-440-38,2,Pratt & Whitney R-2800,1953,-,-, N153JR, 117,Jet One Express,Cargo,-,San Juan-Luis Muñoz Marín International Airport,SJU,TJSJ,Puerto Rico,Sint Maarten-Juliana Airport,SXM,TNCM,Sint Maarten,2,0,2,0,-,-,Final
20120315-1,Thursday,15-MAR-2012,14:57,A1, En route (ENR),Mount Kebnekaise,Sweden,5,5, Destroyed, Written off (damaged beyond repair),Lockheed C-130J-30 Super Hercules,4,Rolls-Royce AE2100D3,2010,-,856.0, 5630, 5630,Norwegian AF,Military,-,Harstad-Narvik-Evenes Airport,EVE,ENEV,Norway,Kiruna Airport,KRN,ESNQ,Sweden,4,1,4,1,-,-,Final
20120315-2,Thursday,15-MAR-2012,13:50,A1, Landing (LDG),"Franklin-Macon County Airport, NC",United States of America,5,5, Destroyed, Written off (damaged beyond repair),Cessna 501 Citation I/SP,2,Pratt & Whitney Canada JT15D-1B,1982,-,4825.0, N7700T, 501-0248,private,Private,-,Venice Municipal Airport,VNC,KVNC,United States of America,-,-,-,-,1,4,1,4,-,-,Final
20120316-0,Friday,16-MAR-2012,17:52,A2, Takeoff (TOF),Quito-Mariscal Sucre Airport (UIO),Ecuador,35,0, Substantial,-,CASA CN-235M-100,2,General Electric CT7-9C,2004,-,-, AEE-503, 150,Ecuador Army,Military,-,Quito-Mariscal Sucre Airport,UIO,SEQU,Ecuador,Guayaquil-José Joaquín de Olmedo International Airport,GYE,SEGU,Ecuador,2,33,0,0,-,-,Preliminary
20120317-0,Saturday,17-MAR-2012,11:29,A2, Landing (LDG),"Blue River Airport, BC",Canada,3,0, Substantial,-,Beechcraft 1900C,-,-,1989,-,-, C-GCMZ, UC-61,Northern Thunderbird Air,Domestic Scheduled Passenger,-,Vancouver International Airport,YVR,CYVR,Canada,-,-,-,-,2,1,0,0,-,-,Final
20120322-0,Thursday,22-MAR-2012,-,A1, Landing (LDG),"50 km (31.3 mls) N of Byelaya Kalitva, Rostov region",Russia,-,0, Damaged beyond repair,-,Antonov An-2,-,-,-,-,-, FLA-1041K,-,private,Illegal Flight,-,-,-,-,-,-,-,-,-,-,-,0,0,-,-,-
20120322-1,Thursday,22-MAR-2012,00:56,A1, En route (ENR),10 km (6.3 mls) NNE of Puerto Aguirre,Chile,8,8, Destroyed, Written off (damaged beyond repair),Beechcraft B300 Super King Air 350,2,Pratt & Whitney Canada PT6A-60A,1995,-,6218.0, CC-AEB, FL-128,INAER Helicopter Chile,Ambulance,-,Punta Arenas-Carlos Ibañez Airport,PUQ,SCCI,Chile,Santiago-Arturo Merino Benitez Airport,SCL,SCEL,Chile,2,6,2,6,-,-,Final
20120322-2,Thursday,22-MAR-2012,19:15,A1, Taxi (TXI),San Juan-Luis Muñoz Marín International Airport (SJU),Puerto Rico,2,0, Minor, Written off (damaged beyond repair),Douglas C-54G Skymaster (DC-4),4,Wright R-2600,1945,-,-, N406WA, 35944,Jet One Express,Cargo,-,Saint Croix-Henry E. Rohlsen Airport,STX,TISX,U.S. Virgin Islands,San Juan-Luis Muñoz Marín International Airport,SJU,TJSJ,Puerto Rico,2,0,0,0,-,-,- (No safety board investigation)
20120324-0,Saturday,24-MAR-2012,15:30,A2, Landing (LDG),"off Abalone Caye, Port Honduras Marine Reserve",Belize,1,0, Substantial,-,Cessna 208 Caravan I,1,Pratt & Whitney Canada PT6A-114,2006,-,-, N208JS, 20800400,private,Ferry/positioning,-,-,-,-,-,-,-,-,-,1,0,0,0,-,-,Preliminary
20120329-0,Thursday,29-MAR-2012,09:45,A1, Landing (LDG),Wau Airport (WUU),South Sudan,55,0, Substantial,-,Fokker 50,2,Pratt & Whitney Canada PW125B,1992,-,-, ST-NEX, 20248,Feeder Airlines,Domestic Scheduled Passenger, 360,Juba Airport,JUB,HSSJ,South Sudan,Wau Airport,WUU,HSWW,South Sudan,5,50,0,0,-,-,Preliminary
20120331-0,Saturday,31-MAR-2012,16:08,A2, Approach (APR),Tokyo Haneda International Airport - HND/RJTT,Japan,308,0, Substantial, Repaired,Boeing 777-246ER,-,-,2002,-,30856.0, JA701J, 32889/410,JAL,International Scheduled Passenger, 82,Shanghai-Hongqiao Airport,SHA,ZSSS,China,Tokyo-Haneda Airport,HND,RJTT,Japan,12,296,0,0,-,-,Final
20120402-0,Monday,02-APR-2012,07:35,A1, Initial climb (ICL),"1,6 km (1 mls) SW of Tyumen Airport (TJM)",Russia,43,33, Destroyed, Written off (damaged beyond repair),ATR 72-201,2,Pratt & Whitney Canada PW124B,1992,49663.0,35523.0, VP-BYZ, 332,UTair Aviation,Domestic Scheduled Passenger, 120,Tyumen-Roschino International Airport,TJM,USTR,Russia,Surgut Airport,SGC,USRR,Russia,4,39,4,29,-,-,Final
20120402-1,Monday,02-APR-2012,-,A1, Landing (LDG),Doro Airstrip,South Sudan,-,0, Damaged beyond repair,-,Hawker Siddeley HS-748-287 Srs. 2B,-,-,1975,-,-, 5Y-BZR, 1736,Timbis Air Services,Cargo,-,-,-,-,-,-,-,-,-,-,-,0,0,-,-,Preliminary
20120409-0,Monday,09-APR-2012,10:14,A1, Takeoff (TOF),Kigoma Airport (TKQ),Tanzania,39,0, Damaged beyond repair,-,de Havilland Canada DHC-8-311Q,2,Pratt & Whitney Canada PW123,1997,-,-, 5H-MWG, 462,Air Tanzania,Domestic Scheduled Passenger, 119,Kigoma Airport,TKQ,HTKA,Tanzania,Tabora Airport,TBO,HTTB,Tanzania,4,35,0,0,-,-,Preliminary
20120414-0,Saturday,14-APR-2012,12:08,A2, Takeoff (TOF),Chambéry Airport (CMF),France,136,0, Substantial, Repaired,Boeing 737-33A (QC),2,CFMI CFM56-3C1,1991,-,-, G-ZAPZ, 25401/2067,Titan Airways,Int'l Non Scheduled Passenger,76B,Chambéry Airport,CMF,LFLB,France,London-Gatwick Airport,LGW,EGKK,United Kingdom,5,131,0,0,-,-,Final
20120415-0,Sunday,15-APR-2012,05:52,O1, Standing (STD),"Moline-Quad-City Airport, IL (MLI)",United States of America,0,0, Substantial, Written off (damaged beyond repair),Canadair CL-600-2B19 Regional Jet CRJ-200ER,2,General Electric CF34-3B1,2002,-,-, N684BR, 7708,Delta Connection,-,-,-,-,-,-,-,-,-,-,0,0,0,0,-,-,Preliminary
20120415-1,Sunday,15-APR-2012,13:21,A1, Landing (LDG),Yida Airstrip,South Sudan,3,0, Damaged beyond repair,-,Fokker F-27 Friendship 500,2,Rolls-Royce Dart 534-2,1968,-,-, 5Y-SRJ, 10372,Sky Relief Services,Cargo,-,Lokichoggio Airport,LKG,HKLK,Kenya,-,-,-,-,3,0,0,0,-,-,Preliminary - official
20120420-0,Friday,20-APR-2012,18:40,A1, Approach (APR),"4,2 km (2.6 mls) SE of Islamabad-Benazir Bhutto International Airport (ISB)",Pakistan,127,127, Destroyed, Written off (damaged beyond repair),Boeing 737-236A,2,Pratt & Whitney JT8D-15A,1984,37824.0,46933.0, AP-BKC, 23167/1074,Bhoja Airlines,Domestic Scheduled Passenger,B4213,Karachi-Jinnah International Airport,KHI,OPKC,Pakistan,Islamabad-Benazir Bhutto International Airport,ISB,OPRN,Pakistan,6,121,6,121,-,-,Final
20120421-0,Saturday,21-APR-2012,08:13,A1, Approach (APR),Santa Cruz-Viru Viru International Airport (VVI),Bolivia,4,3, Destroyed, Written off (damaged beyond repair),Curtiss C-46F-1-CU Commando,2,Pratt & Whitney R-2800,1945,-,29080.0, CP-1319, 22428,SkyTeam Cargo,Cargo,-,Santa Cruz-Viru Viru International Airport,VVI,SLVR,Bolivia,Cobija-E. Beltram Airport,CIJ,SLCO,Bolivia,3,1,3,0,-,-,Final
20120422-0,Sunday,22-APR-2012,-,A2, Landing (LDG),Karachi-Jinnah International Airport (KHI),Pakistan,178,0, Substantial, Repaired,Boeing 737-4H6,2,CFMI CFM56-3C1,1993,-,-, AP-BJN, 26460/2533,Shaheen Air,Domestic Scheduled Passenger, 122,Islamabad-Benazir Bhutto International Airport,ISB,OPRN,Pakistan,Karachi-Jinnah International Airport,KHI,OPKC,Pakistan,6,172,0,0,-,-,Preliminary
20120423-0,Monday,23-APR-2012,08:45,A1, Landing (LDG),Dârvari,Romania,2,0, Substantial, Written off (damaged beyond repair),Antonov An-2R,1,Shvetsov ASh-62IR,1981,-,5461.0, YR-BOR, 1G192-13,Aerogetic,Agricultural,-,-,-,-,-,-,-,-,-,2,0,0,0,-,-,Final
20120427-0,Friday,27-APR-2012,10:00,A1, Landing (LDG),Laguna Salada,Mexico,-,0, Damaged beyond repair,-,Boeing 727-212,3,Pratt & Whitney JT8D-17 (HK3),1977,-,-, XB-MNP, 21348/1287,Unknown,Test,-,Mexicali Airport,MXL,MMML,Mexico,-,-,-,-,-,0,0,0,-,-,Preliminary
20120428-0,Saturday,28-APR-2012,14:55,A1, Landing (LDG),Galkayo Airport (GLK),Somalia,36,0, Damaged beyond repair,-,Antonov An-24RV,2,Ivchenko AI-24VT,1973,-,-, 3X-GEB, 37308403,Jubba Airways,Domestic Scheduled Passenger,-,Hargeisa Airport,HGA,HCMH,Somalia,Galkayo Airport,GLK,HCMR,Somalia,4,32,0,0,-,-,Preliminary
20120430-0,Monday,30-APR-2012,08:51,A1, Landing (LDG),Dhaka-Shahjalal International Airport (DAC),Bangladesh,15,0, Substantial, Written off (damaged beyond repair),ATR 72-212A (ATR-72-500),2,Pratt & Whitney Canada PW127M,2009,-,-, L16-2/52, 881,Thai AF,Military, 304,Bangkok-Don Muang International Airport,DMK,VTBD,Thailand,Dhaka-Shahjalal International Airport,DAC,VGHS,Bangladesh,7,8,0,0,-,-,Preliminary
20120501-0,Tuesday,01-MAY-2012,14:49,A2, Landing (LDG),Jeddah-King Abdulaziz International Airport (JED),Saudi Arabia,10,0, Substantial,-,Airbus A300B4-605R,2,General Electric CF6-80C2A5,1994,18308.0,54832.0, TC-OAG, 747,Onur Air,Ferry/positioning,2865,Madinah-Mohammad Bin Abdulaziz Airport,MED,OEMA,Saudi Arabia,Jeddah-King Abdulaziz International Airport,JED,OEJN,Saudi Arabia,10,0,0,0,-,-,Final
20120502-0,Wednesday,02-MAY-2012,10:38,A1, Landing (LDG),Yambio Airport,South Sudan,11,0, Substantial,-,Cessna 208B Grand Caravan,1,Pratt & Whitney Canada PT6A-114A,1992,-,-, 5Y-NGO, 208B0322,Airworks,Domestic Non Scheduled Passenger,-,Juba Airport,JUB,HSSJ,South Sudan,-,-,-,-,2,9,0,0,-,-,Preliminary - official
20120509-0,Wednesday,09-MAY-2012,14:32,A1, En route (ENR),75 km (46.9 mls) S of Jakarta,Indonesia,45,45, Destroyed, Written off (damaged beyond repair),Sukhoi Superjet 100-95B,2,PowerJet SaM146,2009,502.0,843.0, 97004, 95004,Sukhoi Civil Aircraft,Demonstration,36801,Jakarta-Halim Perdana Kusuma Airport,HLP,WIHH,Indonesia,Jakarta-Halim Perdana Kusuma Airport,HLP,WIHH,Indonesia,4,41,4,41,-,-,Final
20120511-0,Friday,11-MAY-2012,12:05,A2, Landing (LDG),Guatemala City-La Aurora Airport (GUA),Guatemala,2,0, Substantial, Repaired,Convair CV-580F SCD,2,Allison 501-D13D,1956,29707.0,42341.0, N171FL, 318,Contract Air Cargo,Cargo,8138,Miami International Airport,MIA,KMIA,United States of America,Guatemala City-La Aurora Airport,GUA,MGGT,Guatemala,2,0,0,0,-,-,Final
20120514-0,Monday,14-MAY-2012,09:30,A1, Approach (APR),5 km (3.1 mls) SW of Jomsom Airport (JMO),Nepal,21,15, Destroyed, Written off (damaged beyond repair),Dornier 228-212,2,Garrett TPE331-5A-252D,1997,-,-, 9N-AIG, 8216,Agni Air,Domestic Scheduled Passenger,-,Pokhara Airport,PKR,VNPK,Nepal,Jomsom Airport,JMO,VNJS,Nepal,3,18,2,13,-,-,Preliminary
20120515-0,Tuesday,15-MAY-2012,02:40,A2, Landing (LDG),Sasereme Airstrip,Papua New Guinea,16,0, Substantial, Repaired,de Havilland Canada DHC-6 Twin Otter 300,2,Pratt & Whitney Canada PT6A-27,1971,-,50168.0, P2-MCZ, 330,Airlines PNG,Domestic Scheduled Passenger,-,Port Moresby-Jacksons International Airport,POM,AYPY,Papua New Guinea,-,-,-,-,2,14,0,0,-,-,Final
20120517-0,Thursday,17-MAY-2012,14:07,A2, Landing (LDG),München-Franz Josef Strauss Airport (MUC),Germany,62,0, Substantial, Repaired,ATR 72-212A (ATR-72-500),2,Pratt & Whitney Canada PW127F,2001,-,-, I-ADCD, 664,Air Dolomiti,International Scheduled Passenger,LH1912,München-Franz Josef Strauss Airport,MUC,EDDM,Germany,Venice-Marco Polo Airport,VCE,LIPZ,Italy,4,58,0,0,-,-,Preliminary
20120517-1,Thursday,17-MAY-2012,07:15,A1, Taxi (TXI),"Houston-George Bush Intercontinental Airport, TX (IAH)",United States of America,2,0, Substantial, Written off (damaged beyond repair),Shorts 360-100,2,Pratt & Whitney Canada PT6A-65AR,1983,-,27504.0, N617FB, SH.3617,Air Cargo Carriers,Cargo,-,Houston-George Bush Intercontinental Airport,IAH,KIAH,United States of America,Austin-Bergstrom International Airport,AUS,KAUS,United States of America,2,0,0,0,-,-,Final
20120518-0,Friday,18-MAY-2012,-,O2, Standing (STD),Gödöllõ Airfield,Hungary,-,0, Substantial, Repaired,Antonov An-2T,1,Shvetsov ASh-62IR,1980,-,-, HA-MEA, 1G186-07,Sky Escort Aero-Club Hungary,-,-,-,-,-,-,-,-,-,-,-,0,0,0,-,-,Preliminary
20120523-0,Wednesday,23-MAY-2012,11:50,A1, Landing (LDG),Cáslav Air Base,Czech Republic,23,0, Destroyed, Written off (damaged beyond repair),Antonov An-30B,-,-,-,-,-, 04 Black, 0704,Russian AF,Military,-,-,-,-,-,-,-,-,-,-,-,0,0,-,-,Preliminary
20120524-0,Thursday,24-MAY-2012,-,A2, Approach (APR),"near Tampa-Mac Dill AFB, FL (MCF)",United States of America,-,0, Substantial, Repaired,Canadair CC-144A Challenger 600,2,Lycoming ALF502L-2,1983,-,-, 144601, 1040,RCAF,Military,-,-,-,-,-,Tampa-MacDill AFB,MCF,KMCF,United States of America,-,-,0,0,-,-,Preliminary
20120525-0,Friday,25-MAY-2012,-,A2, Landing (LDG),Lézignan-Corbières Airport,France,1,0, Substantial, Repaired,Cessna 208B Super Cargomaster,1,Pratt & Whitney Canada PT6A-114A,2005,-,-, D-FAAF, 208B1125,Skydive Flyzone,Parachuting,-,-,-,-,-,-,-,-,-,1,0,0,0,-,-,Preliminary
20120528-0,Monday,28-MAY-2012,-,A2, Unknown (UNK),Mumbai (Bombay) Airport (BOM),India,-,0, Substantial, Repaired,Boeing 777-237LR,2,General Electric GE90-110B1L,2009,-,-, VT-ALH, 36307/805,Air India,Unknown,-,-,-,-,-,-,-,-,-,-,-,0,0,-,-,Preliminary
20120530-0,Wednesday,30-MAY-2012,13:00,A2, Standing (STD),"Chicago-O'Hare International Airport, IL (ORD)",United States of America,21,0, Substantial, Repaired,Embraer EMB-140 (ERJ-135KL),2,Allison AE3007A1/3,2002,-,24059.0, N834AE, 145631,American Eagle,Domestic Scheduled Passenger,4265,Springfield-Branson National Airport,SGF,KSGF,United States of America,Chicago-O'Hare International Airport,ORD,KORD,United States of America,3,18,0,0,-,-,Final
20120530-1,Wednesday,30-MAY-2012,13:00,A2, Taxi (TXI),"Chicago-O'Hare International Airport, IL (ORD)",United States of America,3,0, Minor, Repaired,Boeing 747-45EF,4,General Electric CF6-80C2B1F,2000,-,57114.0, B-16481, 30607/1251,Eva Air,Cargo,661,Chicago-O'Hare International Airport,ORD,KORD,United States of America,Anchorage-Ted Stevens International Airport,ANC,PANC,United States of America,3,0,0,0,-,-,Final
20120601-0,Friday,01-JUN-2012,12:35,A1, Landing (LDG),Pontianak-Supadio Airport (PNK),Indonesia,163,0, Substantial, Written off (damaged beyond repair),Boeing 737-4Y0,2,CFMI CFM56-3C1,1990,-,-, PK-CJV, 24689/1883,Sriwijaya Air,Domestic Scheduled Passenger, 188,Jakarta-Soekarno-Hatta International Airport,CGK,WIII,Indonesia,Pontianak-Supadio Airport,PNK,WIOO,Indonesia,8,155,0,0,-,-,Preliminary
20120602-0,Saturday,02-JUN-2012,19:10,A1, Landing (LDG),Accra-Kotoka Airport (ACC),Ghana,4,0, Damaged beyond repair,-,Boeing 727-221F,3,Pratt & Whitney JT8D-17A (HK3),1982,-,-, 5N-BJN, 22540/1796,Allied Air,Cargo, 111,Lagos-Murtala Muhammed International Airport,LOS,DNMM,Nigeria,Accra-Kotoka Airport,ACC,DGAA,Ghana,4,0,0,0,-,12,Preliminary
20120603-0,Sunday,03-JUN-2012,15:45,A1, Approach (APR),"9,3 km (5.8 mls) N of Lagos-Murtala Muhammed International Airport (LOS)",Nigeria,153,153, Destroyed, Written off (damaged beyond repair),McDonnell Douglas DC-9-83 (MD-83),2,Pratt & Whitney JT8D-219,1990,35219.0,60846.0, 5N-RAM, 53019/1783,Dana Air,Domestic Scheduled Passenger,9J992,Abuja International Airport,ABV,DNAA,Nigeria,Lagos-Murtala Muhammed International Airport,LOS,DNMM,Nigeria,6,147,6,147,-,6,Final
20120603-1,Sunday,03-JUN-2012,13:47,A1, Maneuvering (MNV),"ca 35km W of Modena, Iron County, UT",United States of America,2,2, Substantial, Written off (damaged beyond repair),Lockheed P-2H Neptune,2,Wright R-3350-32WA Cyclone,-,-,12313.0, N14447, 826-8010,Neptune Aviation Services,Fire fighting,-,Cedar City Airport,CDC,KCDC,United States of America,Cedar City Airport,CDC,KCDC,United States of America,2,0,2,0,-,-,Final
20120603-2,Sunday,03-JUN-2012,13:50,A1, Landing (LDG),"Minden-Tahoe Airport, NV (MEV)",United States of America,2,0, Minor, Written off (damaged beyond repair),Lockheed SP-2H Neptune,-,-,1957,-,-, N355MA, 	726-7229,Minden Air Corporation,Fire fighting,-,Porterville Airport,PTV,KPTV,United States of America,Porterville Airport,PTV,KPTV,United States of America,2,0,0,0,-,-,- (No safety board investigation)
20120606-0,Wednesday,06-JUN-2012,20:00,A1, En route (ENR),"1,5 km (0.9 mls) S off  Isla de Flores, Rio de la Plata",Uruguay,2,2, Destroyed, Written off (damaged beyond repair),Swearingen SA227-AC Metro III,2,Garrett TPE331-11U-611G,1982,-,26158.0, CX-LAS, AC-482,Air Class Líneas Aéreas,Cargo,-,Montevideo-Carrasco Airport,MVD,SUMU,Uruguay,Buenos Aires/Ezeiza-Ministro Pistarini Airport,EZE,SAEZ,Argentina,2,0,2,0,-,-,Final
20120607-0,Thursday,07-JUN-2012,12:24,A1, Landing (LDG),"Aspen-Pitkin County Airport, CO (ASE)",United States of America,8,0, Substantial, Written off (damaged beyond repair),Learjet 60,2,Pratt & Whitney Canada PW305,1993,-,6456.0, N500SW, 60-017,Performance Aircraft Leasing,Private,-,Opa-Locka Airport,OPF,KOPF,United States of America,Aspen-Pitkin County Airport,ASE,KASE,United States of America,2,6,0,0,-,-,Final
20120609-0,Saturday,09-JUN-2012,21:15,O1, Standing (STD),Praha-Ruzyne International Airport (PRG),Czech Republic,0,0, Destroyed, Written off (damaged beyond repair),ATR 42-500,2,Pratt & Whitney Canada PW127E,2005,-,-, OK-KFM, 635,CSA,-,-,-,-,-,-,-,-,-,-,0,0,0,0,-,-,Preliminary
20120610-0,Sunday,10-JUN-2012,10:40,A1, Approach (APR),Borodyanka,Ukraine,20,5, Damaged beyond repair,-,Let L-410UVP,2,Walter M-601D,1981,-,-, UR-SKD, 810721,Ukrainska Shkola Pilotov,Parachuting,-,-,-,-,-,-,-,-,-,2,18,1,4,-,-,Preliminary
